[
  {
    "quality_assessment_id": "quality-basic-rollup-001",
    "created_time": "2026-01-01T00:00:10Z",
    "assessor_ref": "formal-rollup-node-example",
    "subject_refs": [
      "rollup-basic-001",
      "federation-basic-001",
      "bundle-basic-rollup-exchange-001"
    ],
    "basis_refs": [
      "review-rollup-basic-001",
      "exchange-receipt-basic-accept-001",
      "reconciliation-basic-rollup-001"
    ],
    "confidence_level": "medium",
    "quality_flags": [
      "synthetic-example",
      "single-source",
      "reviewed"
    ],
    "uncertainty_summary": "Synthetic fixture. Demonstrates quality assessment shape, not real confidence.",
    "recommended_use": "Use as an example of quality metadata attached to rollup and exchange records."
  }
]
